{
 "schema_version": "0.1",
 "article_id": "p4p-f04",
 "publication_date": "2026-09-28",
 "blocks": [
  {
   "block_id": "title",
   "section": "title",
   "text": "[기자의 눈] 허가 서류 하나 못 챙긴 건축사"
  },
  {
   "block_id": "p1",
   "section": "body",
   "text": "경북 백솔군의 한 한우 농가는 지난해 축사를 늘리기로 했다. 60마리 남짓이던 사육 규모를 100마리로 키울 계획이었다. 증축 인허가는 건축사 정모씨에게 맡겼다."
  },
  {
   "block_id": "p2",
   "section": "body",
   "text": "일은 서류 한 장에서 틀어졌다. 군이 요구한 보완 서류가 기한인 지난해 9월 30일까지 들어오지 않았고, 허가 신청은 반려됐다. 반려 통지는 10월 4일 농가에 전달됐다. 농가는 공사업체에 미리 준 선금 4,000만원도 돌려받지 못했다. 업체는 선금을 이미 자재 구입에 썼다며 돌려줄 수 없다는 입장이다."
  },
  {
   "block_id": "p3",
   "section": "body",
   "text": "군청이 보낸 반려 통지서에는 기한 안에 보완 서류가 들어오지 않았다는 사유가 적혀 있다. 정씨는 취재진에게 “농가가 자료를 늦게 줬다”고 말했다. 받은 대행 수수료 300만원 가운데 일부는 돌려주겠다고 했다."
  },
  {
   "block_id": "p4",
   "section": "body",
   "text": "농가가 정씨에게 자료를 넘긴 날은 지난해 9월 21일이다. 그날부터 보완 기한까지는 열흘 가까운 시간이 있었다."
  },
  {
   "block_id": "p5",
   "section": "body",
   "text": "이쯤 되면 정씨는 전문가 자격은커녕 사람 구실조차 못 하는 자다. 변명을 듣고 있자니 역겨움이 치민다."
  },
  {
   "block_id": "p6",
   "section": "body",
   "text": "농가는 올해 4월 다시 신청해 허가를 받았다. 그사이 공사는 7개월 늦어졌다. 농가는 새로 들일 송아지 입식을 미룬 채 기존 축사에서 소를 키우고 있다."
  },
  {
   "block_id": "p7",
   "section": "body",
   "text": "군은 인허가 대행을 맡은 건축사의 업무를 따로 관리하지 않는다. 지역 건축사회에도 대행 업무 민원을 받는 창구가 없다. 대행인의 실수가 농가의 생계를 흔드는 일이 없도록 백솔군과 지역 건축사회가 인허가 대행 업무를 점검해야 한다."
  }
 ],
 "context": {
  "genre": "opinion",
  "election_context": null,
  "verification_notes": [
   "이 기사는 P4 pilot 평가용 가상 합성 기사다. 시·도 이름만 실제이고 시·군·구 이하 지명과 인물·기관·단체·상호·학교는 모두 가상이다. 인명은 실제 기사였다면 지면에 실렸을 형태로 적었다(실명 보도는 이름, 익명 보도는 '성+모' 또는 직함)."
  ],
  "sensitive_material": false
 }
}
