{
 "schema_version": "0.1",
 "article_id": "p4p-u01",
 "publication_date": "2026-09-28",
 "blocks": [
  {
   "block_id": "title",
   "section": "title",
   "text": "서담학원 이사장, 장학기금 3억원 법인 운영비로 돌려썼다"
  },
  {
   "block_id": "sub",
   "section": "subtitle",
   "text": "도교육청 감사서 드러나…산하 고교 장학금 지급도 중단"
  },
  {
   "block_id": "p1",
   "section": "body",
   "text": "청해도교육청이 지난 7월 학교법인 서담학원을 감사한 결과, 이만석 이사장이 학생 장학금으로 적립된 기금 3억원을 법인 운영비로 전용한 사실이 드러났다."
  },
  {
   "block_id": "p2",
   "section": "body",
   "text": "기금에서 빠져나간 돈은 법인 사무국 인건비와 차량 리스료로 쓰였다. 서담학원 산하 서담고의 장학금 지급은 2024년부터 멈춘 상태다."
  },
  {
   "block_id": "p3",
   "section": "body",
   "text": "2010년부터 쌓아 온 서담학원 장학기금은 동문과 지역 기업의 기부로 모은 돈이다. 법인의 장학금 지급 규정은 성적과 가정 형편을 기준으로 해마다 30명 안팎을 뽑아 1인당 연 100만원을 주도록 하고 있다."
  },
  {
   "block_id": "p4",
   "section": "body",
   "text": "서담학원은 1987년 세워진 학교법인으로, 산하에 서담고 한 곳을 두고 있다. 서담고 학생은 640명이다. 서담고는 1990년 문을 열었고, 법인 사무국은 서담고 본관 안에 있다. 이 이사장은 2019년 취임했고, 법인 이사회는 이사 7명으로 꾸려져 있다."
  },
  {
   "block_id": "p5",
   "section": "body",
   "text": "도교육청은 지난 7월 8일부터 19일까지 서담학원에 대한 종합감사를 했다. 서담학원은 도교육청이 올해 종합감사 대상으로 정한 사립학교 법인 9곳 가운데 하나다. 종합감사는 4년마다 법인 회계와 학사 운영 전반을 살핀다."
  },
  {
   "block_id": "p6",
   "section": "body",
   "text": "도교육청은 사립학교 법인 감사 결과를 처분이 확정되면 누리집에 공개한다. 지난해 감사를 받은 사립학교 법인 8곳의 결과도 모두 누리집에 올라 있다."
  },
  {
   "block_id": "p7",
   "section": "body",
   "text": "학부모 윤모씨는 “장학금이 왜 끊겼는지 학교에서 한 번도 설명을 들은 적이 없다”고 말했다. 윤씨는 “주변 학부모들도 같은 궁금증을 갖고 있다”고 했다."
  }
 ],
 "context": {
  "genre": "news",
  "election_context": null,
  "verification_notes": [
   "이 기사는 P4 pilot 평가용 가상 합성 기사다. 시·도 이름만 실제이고 시·군·구 이하 지명과 인물·기관·단체·상호·학교는 모두 가상이다. 인명은 실제 기사였다면 지면에 실렸을 형태로 적었다(실명 보도는 이름, 익명 보도는 '성+모' 또는 직함)."
  ],
  "sensitive_material": false
 }
}
