{
 "schema_version": "0.1",
 "article_id": "p4p-f03",
 "publication_date": "2026-09-28",
 "blocks": [
  {
   "block_id": "title",
   "section": "title",
   "text": "한내시 동물병원 원장, 면허 없는 직원에게 진정제 조제 맡겨"
  },
  {
   "block_id": "sub",
   "section": "subtitle",
   "text": "한내시, 동물병원 40곳 점검…6곳 적발"
  },
  {
   "block_id": "p1",
   "section": "body",
   "text": "충남 한내시는 이달 1일부터 19일까지 관내 동물병원 40곳의 의약품 관리 실태를 점검해 6곳에서 관리 규정 위반을 적발했다고 28일 밝혔다. 시가 관내 동물병원 전체를 점검한 것은 이번이 처음이다. 적발된 6곳 가운데 4곳은 점검 현장에서 바로 잘못을 고쳤다."
  },
  {
   "block_id": "p2",
   "section": "body",
   "text": "위반 유형을 보면 의약품 관리대장을 쓰지 않은 곳이 3곳, 유효기간이 지난 약을 보관한 곳이 2곳이었다. 나머지 1곳은 수의사가 아닌 직원에게 약 조제를 맡겼다."
  },
  {
   "block_id": "p3",
   "section": "body",
   "text": "시 관계자에 따르면 은포동 누리봄동물병원 원장 강태식(52)씨는 면허 없는 보조 인력에게 진정제 조제를 맡긴 것으로 드러났다. 이 관계자는 “수의사가 아닌 사람이 동물용 의약품을 조제하는 것은 수의사법 위반”이라고 설명했다."
  },
  {
   "block_id": "p4",
   "section": "body",
   "text": "시는 적발된 병원에 업무정지 등 행정처분을 내릴 예정이며, 위반 정도가 무거운 곳은 수사기관에 고발하기로 했다. 처분 수위는 다음 달 청문 절차를 거쳐 정한다. 시는 고발 대상이 몇 곳인지는 청문이 끝난 뒤 밝히겠다고 했다."
  },
  {
   "block_id": "p5",
   "section": "body",
   "text": "이번 점검은 반려동물 진료가 늘면서 동물병원의 의약품 관리도 살펴봐야 한다는 판단에 따라 이뤄졌다. 시에 따르면 지난해 관내 동물병원 진료 건수는 18만건으로 3년 전보다 30% 늘었다. 시는 점검 결과를 지역 수의사회에 알려 위반 사례를 공유하고, 내년부터 관내 동물병원 점검을 해마다 하기로 했다. 한내시수의사회 관계자는 “다음 달 회원 병원을 대상으로 의약품 관리 교육을 열 계획”이라고 말했다."
  },
  {
   "block_id": "cap",
   "section": "caption",
   "text": "한내시 직원들이 관내 한 동물병원에서 의약품 보관함을 점검하고 있다. 한내시 제공"
  }
 ],
 "context": {
  "genre": "news",
  "election_context": null,
  "verification_notes": [
   "이 기사는 P4 pilot 평가용 가상 합성 기사다. 시·도 이름만 실제이고 시·군·구 이하 지명과 인물·기관·단체·상호·학교는 모두 가상이다. 인명은 실제 기사였다면 지면에 실렸을 형태로 적었다(실명 보도는 이름, 익명 보도는 '성+모' 또는 직함)."
  ],
  "sensitive_material": false
 }
}
