{
 "schema_version": "0.1",
 "article_id": "p4p-f01",
 "publication_date": "2026-09-28",
 "blocks": [
  {
   "block_id": "title",
   "section": "title",
   "text": "조합원 정보 빼돌려 경쟁 보험사에 넘긴 솔미농협 직원 구속"
  },
  {
   "block_id": "sub",
   "section": "subtitle",
   "text": "경찰, 개인정보 유출 혐의로 구속…본인은 혐의 부인"
  },
  {
   "block_id": "p1",
   "section": "body",
   "text": "경기 솔미경찰서는 솔미농협 직원 이모(41)씨를 개인정보 보호법 위반 혐의로 구속했다고 28일 밝혔다. 이씨는 조합원 2,300여명의 연락처와 가입 상품 목록을 외부 보험대리점에 건넨 혐의를 받는다. 법원은 지난 26일 증거를 없앨 우려가 있다며 구속영장을 발부했다."
  },
  {
   "block_id": "p2",
   "section": "body",
   "text": "이씨가 빼돌린 명단에는 조합원 가족의 연락처까지 담겨 있었다. 경찰은 이씨가 대리점 측에서 대가를 받았는지도 조사할 방침이다."
  },
  {
   "block_id": "p3",
   "section": "body",
   "text": "수사는 농협의 고소로 시작됐다. 솔미농협은 지난달 자체 감사에서 이씨의 계정으로 조합원 정보가 한꺼번에 조회된 기록을 찾아내 경찰에 고소장을 냈다. 경찰에 따르면 이씨 계정의 조회 기록은 올해 3~6월에 몰려 있었다."
  },
  {
   "block_id": "p4",
   "section": "body",
   "text": "경찰은 지난 20일 해당 보험대리점 사무실을 압수수색해 업무용 컴퓨터를 가져갔다. 대리점 대표 등 2명도 개인정보를 부정하게 넘겨받은 혐의로 입건했다. 경찰 관계자는 “가져온 자료는 아직 분석 중”이라며 “명단이 대리점 영업에 쓰였는지는 확인되지 않았다”고 했다."
  },
  {
   "block_id": "p5",
   "section": "body",
   "text": "솔미농협은 정보가 빠져나갔을 가능성이 있는 조합원들에게 안내 문자를 보냈다. 농협에는 지난주부터 조합원 문의 전화가 300건 넘게 걸려 왔다. 이씨는 직위에서 해제됐다. 농협 관계자는 “직원별 고객정보 조회 권한을 다시 점검하고 있다”고 말했다."
  },
  {
   "block_id": "p6",
   "section": "body",
   "text": "이씨는 혐의를 부인하고 있다. 변호인에 따르면 이씨는 경찰 조사에서 “고객 명단을 외부로 보낸 적이 없다”고 진술했다. 변호인은 “업무상 필요해 조회한 것”이라고 설명했다."
  }
 ],
 "context": {
  "genre": "news",
  "election_context": null,
  "verification_notes": [
   "이 기사는 P4 pilot 평가용 가상 합성 기사다. 시·도 이름만 실제이고 시·군·구 이하 지명과 인물·기관·단체·상호·학교는 모두 가상이다. 인명은 실제 기사였다면 지면에 실렸을 형태로 적었다(실명 보도는 이름, 익명 보도는 '성+모' 또는 직함)."
  ],
  "sensitive_material": false
 }
}
