{
 "schema_version": "0.1",
 "article_id": "p4p-f02",
 "publication_date": "2026-09-28",
 "blocks": [
  {
   "block_id": "title",
   "section": "title",
   "text": "송하시의회 의원실 비서, 업무추진비로 개인 물품 샀다는 말 돌아"
  },
  {
   "block_id": "sub",
   "section": "subtitle",
   "text": "의회 안팎 소문…당사자는 지난달 돌연 사직"
  },
  {
   "block_id": "p1",
   "section": "body",
   "text": "전남 송하시의회 안팎에서 한 의원실 비서가 업무추진비 카드로 가전제품과 상품권을 사들였다는 말이 돌고 있다."
  },
  {
   "block_id": "p2",
   "section": "body",
   "text": "소문의 당사자로 거론되는 사람은 최성균 의원실에서 일하다 지난달 그만둔 유일한 여성 정책비서다."
  },
  {
   "block_id": "p3",
   "section": "body",
   "text": "의회 사무처의 한 직원은 익명을 요청하며 “알 만한 사람은 다 안다”고 말했다. 그는 해당 비서가 업무추진비로 개인 물품을 샀다는 이야기를 의회 안에서 여러 차례 들었다고 했다. 이 이야기는 비서가 그만두기 한두 달 전부터 돌았다고 전했다. 소문이 어디서 시작됐는지는 모른다고 했다."
  },
  {
   "block_id": "p4",
   "section": "body",
   "text": "의회 사무처는 의원실별 업무추진비 집행 내역을 분기마다 누리집에 공개한다. 2019년 시작한 공개 항목은 집행 일자와 금액, 사용처, 목적이다. 누리집에 올라온 2분기 내역을 보면 최성균 의원실은 업무추진비 카드를 31차례 써 412만원을 집행했다. 사용처는 대부분 ‘간담회 식대’로 적혀 있고, 무엇을 샀는지는 나와 있지 않다. 1분기에는 27차례 358만원을 썼다. 2분기 집행액은 의원실 평균 380만원보다 조금 많은 수준이다."
  },
  {
   "block_id": "p5",
   "section": "body",
   "text": "송하시의회 업무추진비 집행 기준은 업무추진비로 개인 물품을 사지 못하도록 하고 있다. 업무추진비 카드는 의원실마다 한 장씩 나오고, 의원의 지시를 받아 비서가 결제할 수 있다. 사무처는 의원실별 카드 사용 내역을 매달 점검해 분기마다 의장에게 보고한다."
  },
  {
   "block_id": "p6",
   "section": "body",
   "text": "사무처에 따르면 올해 들어 업무추진비 부당 사용으로 환수한 사례는 없다. 지난해에는 2건, 46만원을 환수했다. 사무처는 이번 소문과 관련해 따로 조사하지는 않았다."
  }
 ],
 "context": {
  "genre": "news",
  "election_context": null,
  "verification_notes": [
   "이 기사는 P4 pilot 평가용 가상 합성 기사다. 시·도 이름만 실제이고 시·군·구 이하 지명과 인물·기관·단체·상호·학교는 모두 가상이다. 인명은 실제 기사였다면 지면에 실렸을 형태로 적었다(실명 보도는 이름, 익명 보도는 '성+모' 또는 직함)."
  ],
  "sensitive_material": false
 }
}
