{
 "schema_version": "0.1",
 "article_id": "p4p-p08",
 "publication_date": "2026-09-28",
 "blocks": [
  {
   "block_id": "title",
   "section": "title",
   "text": "가온시 하프마라톤 내달 11일…강변로 오전 통제"
  },
  {
   "block_id": "sub",
   "section": "subtitle",
   "text": "6,000여명 참가…시내버스 14개 노선 임시 우회"
  },
  {
   "block_id": "p1",
   "section": "body",
   "text": "강원 가온시는 다음 달 11일 오전 7시부터 낮 12시까지 하프마라톤 대회를 연다고 28일 밝혔다. 올해로 12회째인 대회에는 6,000여명이 참가한다. 지난해 대회 참가자는 5,200여명이었다."
  },
  {
   "block_id": "p2",
   "section": "body",
   "text": "코스는 시청 앞 광장을 출발해 강변공원을 돌아오는 하프(21.0975㎞)와 10㎞, 5㎞ 세 종류다. 코스별로는 10㎞ 신청자가 2,700여명으로 가장 많다. 하프 코스의 제한 시간은 3시간이다."
  },
  {
   "block_id": "p3",
   "section": "body",
   "text": "시는 대회 시간 동안 강변로 양방향 차량 통행을 막고, 시내버스 14개 노선을 임시로 우회 운행한다. 시청 앞 광장 주변 공영주차장 3곳도 이날 오전에는 문을 닫는다. 시는 지난해 교통 통제와 관련한 민원이 40여건 들어온 점을 고려해 올해는 통제 시간을 1시간 줄였다."
  },
  {
   "block_id": "p4",
   "section": "body",
   "text": "시 관계자는 “통제 구간과 우회 노선은 시 누리집과 버스정류장 안내문에서 확인할 수 있다”고 말했다. 우회 노선은 버스정보 앱에서도 볼 수 있다. 시는 코스 주변 주민들에게 통제 안내문을 나눠 줬다."
  },
  {
   "block_id": "p5",
   "section": "body",
   "text": "대회 당일 코스 주변에는 구급차 6대와 의료 인력 40명이 배치된다. 자원봉사자 300명은 주요 교차로에서 교통 안내를 맡는다. 비가 와도 대회는 예정대로 열린다."
  },
  {
   "block_id": "p6",
   "section": "body",
   "text": "참가 접수는 지난 15일 마감됐다. 참가 물품은 대회 전날인 10일 오후 시청 앞 광장에서 나눠 준다. 완주자에게는 모두 기념 메달을 주고, 기록은 당일 오후 대회 누리집에 올린다. 시는 외지 참가자 2,000여명이 시를 찾을 것으로 내다봤다."
  },
  {
   "block_id": "cap",
   "section": "caption",
   "text": "지난해 열린 가온시 하프마라톤 대회에서 참가자들이 달리고 있다. 가온시 제공"
  }
 ],
 "context": {
  "genre": "news",
  "election_context": null,
  "verification_notes": [
   "이 기사는 P4 pilot 평가용 가상 합성 기사다. 시·도 이름만 실제이고 시·군·구 이하 지명과 인물·기관·단체·상호·학교는 모두 가상이다. 인명은 실제 기사였다면 지면에 실렸을 형태로 적었다(실명 보도는 이름, 익명 보도는 '성+모' 또는 직함)."
  ],
  "sensitive_material": false
 }
}
