{
 "schema_version": "0.1",
 "article_id": "p4p-p03",
 "publication_date": "2026-09-28",
 "blocks": [
  {
   "block_id": "title",
   "section": "title",
   "text": "은석시의회 다수당 “퇴직 공무원 모임은 시장 재선 조직” 공세"
  },
  {
   "block_id": "sub",
   "section": "subtitle",
   "text": "모임 측 “회비로 운영하는 친목 단체…근거 없는 정치 공세” 반발"
  },
  {
   "block_id": "p1",
   "section": "body",
   "text": "충북 은석시의회 다수당 원내대변인인 조병철 의원은 28일 정례 브리핑에서 시청 퇴직 간부들이 만든 ‘은석사랑회’를 두고 “친목을 내세운 시장 재선 조직”이라며 “활동 자금의 출처를 밝히라”고 요구했다."
  },
  {
   "block_id": "p2",
   "section": "body",
   "text": "조 의원은 이 모임 회원 상당수가 시장 측근 인사들과 가깝다는 점을 근거로 들었다. 다만 구체적인 자금 흐름 자료는 내놓지 않았다. 브리핑에는 다수당 의원 3명이 함께했다. 조 의원은 모임 행사에 시장 측근 인사들이 여러 차례 참석했다고 주장하며, 시 감사관실에 모임 활동과 관련한 조사를 요구하겠다고 밝혔다. 시 감사관실은 “의회의 요구가 공식 접수되면 검토하겠다”는 입장이다."
  },
  {
   "block_id": "p3",
   "section": "body",
   "text": "은석사랑회는 2021년 시청 퇴직 간부들이 만든 단체로, 회원은 120여명이다. 회원들은 매달 회비 1만원을 내고, 한 달에 한 번 등산을 하며 분기마다 봉사활동을 한다고 장 회장은 설명했다. 회비 밖의 후원금은 받지 않는다고 했다."
  },
  {
   "block_id": "p4",
   "section": "body",
   "text": "은석사랑회 장한식 회장은 “회비로 운영되는 퇴직자 친목 단체로 선거와 무관하다”며 “근거 없는 정치 공세”라고 반박했다."
  },
  {
   "block_id": "p5",
   "section": "body",
   "text": "시장 비서실 관계자는 “시장은 이 모임과 관계가 없다”며 “따로 대응할 계획은 없다”고 말했다."
  },
  {
   "block_id": "p6",
   "section": "body",
   "text": "시의회 소수당은 논평을 내고 “다수당이 퇴직 공무원들을 정쟁에 끌어들이고 있다”고 비판했다. 여야는 지난 15일 본회의 시정질문에서도 시장 측근 인사의 산하기관장 임명을 놓고 맞섰다. 다수당은 시의회 23석 가운데 14석을 차지하고 있다."
  }
 ],
 "context": {
  "genre": "news",
  "election_context": null,
  "verification_notes": [
   "이 기사는 P4 pilot 평가용 가상 합성 기사다. 시·도 이름만 실제이고 시·군·구 이하 지명과 인물·기관·단체·상호·학교는 모두 가상이다. 인명은 실제 기사였다면 지면에 실렸을 형태로 적었다(실명 보도는 이름, 익명 보도는 '성+모' 또는 직함)."
  ],
  "sensitive_material": false
 }
}
