{
 "schema_version": "0.1",
 "article_id": "p4p-p01",
 "publication_date": "2026-09-28",
 "blocks": [
  {
   "block_id": "title",
   "section": "title",
   "text": "“수사팀이 진술 바꾸라 했다”…은석시 산단 비리 핵심 참고인 가족, 메모·녹음 공개"
  },
  {
   "block_id": "sub",
   "section": "subtitle",
   "text": "가족 “회유 정황” 주장…경찰 “회유 없었다” 반박"
  },
  {
   "block_id": "p1",
   "section": "body",
   "text": "충북 은석시 산업단지 개발 비리를 수사하는 은석경찰서 수사팀이 핵심 참고인 박모씨에게 진술을 바꾸도록 회유했다는 주장이 나왔다."
  },
  {
   "block_id": "p2",
   "section": "body",
   "text": "박씨의 형은 23일 박씨가 직접 쓴 메모 2장과 형제가 나눈 통화 녹음 파일을 본지에 건넸다. 메모에는 “조사관이 새벽까지 조사하며 처음 진술을 뒤집으라고 몰아붙였다”는 문장이 적혀 있다. 녹음 파일에는 박씨가 형에게 “처음 한 말을 바꾸라는 얘기를 계속 들었다”고 말하는 대목이 담겼다."
  },
  {
   "block_id": "p3",
   "section": "body",
   "text": "박씨의 변호인에 따르면 박씨는 참고인 신분으로 세 차례 경찰 조사를 받았다. 메모는 이달 17일 조사를 받은 다음 날 썼다고 한다. 형은 “동생이 조사를 받고 올 때마다 많이 힘들어했다”고 말했다."
  },
  {
   "block_id": "p4",
   "section": "body",
   "text": "본지는 메모의 필체를 박씨가 앞서 시청에 낸 자필 민원서와 대조했고, 녹음 속 목소리가 박씨의 것이라는 점을 박씨의 변호인을 통해 확인했다. 다만 메모와 녹음에 담긴 내용이 사실인지는 확인되지 않았다."
  },
  {
   "block_id": "p5",
   "section": "body",
   "text": "경찰은 지난 8월 산업단지 개발 과정에서 뇌물을 주고받은 혐의로 시 공무원 2명과 개발업체 대표를 입건해 수사하고 있다. 업체 대표가 산업단지 인허가 과정에서 편의를 받는 대가로 인허가 부서 공무원들에게 돈을 건넨 혐의다."
  },
  {
   "block_id": "p6",
   "section": "body",
   "text": "은석경찰서 수사팀 관계자는 “조사는 변호인 입회 아래 원칙대로 진행됐고 회유는 없었다”고 밝혔다. 이 관계자는 “조사 과정은 모두 영상으로 녹화했다”고 덧붙였다. 경찰은 박씨 측이 공식적으로 문제를 제기하면 사실관계를 확인하겠다고 했다."
  }
 ],
 "context": {
  "genre": "news",
  "election_context": null,
  "verification_notes": [
   "이 기사는 P4 pilot 평가용 가상 합성 기사다. 시·도 이름만 실제이고 시·군·구 이하 지명과 인물·기관·단체·상호·학교는 모두 가상이다. 인명은 실제 기사였다면 지면에 실렸을 형태로 적었다(실명 보도는 이름, 익명 보도는 '성+모' 또는 직함)."
  ],
  "sensitive_material": false
 }
}
